{
  "schema_version": "0.1",
  "fixture": true,
  "project_id": "nfl2026-design-fixture",
  "prediction_id": "fixture-forecast-points-001",
  "revision": 2,
  "status": "final",
  "source_record_id": "fixture-correction-001",
  "source_sha256": "dddddddddddddddddddddddddddddddddddddddddddddddddddddddddddddddd",
  "source_observed_at": "2026-10-14T08:00:00Z",
  "resolved_at": "2026-10-14T08:01:00Z",
  "supersedes_revision": 1,
  "correction_reason": "Illustrative authoritative stat correction",
  "result": {
    "kind": "points",
    "value": 12.7
  }
}
